{
  "appExitedAtEnd": false,
  "effects": [
    "1",
    "2",
    "3",
    "4",
    "5",
    "6",
    "7",
    "8",
    "9",
    "10",
    "11",
    "12",
    "13",
    "14",
    "15",
    "16",
    "17",
    "18",
    "19",
    "20",
    "21",
    "22",
    "23",
    "24",
    "25",
    "26",
    "27",
    "28",
    "29",
    "30",
    "31",
    "32",
    "33",
    "34",
    "35",
    "36",
    "37",
    "38",
    "39",
    "40"
  ],
  "fault": "postmaster-restart",
  "faultCount": 1,
  "faults": [
    {
      "appExited": true,
      "batch": 1,
      "effectsAfter": [
        "1",
        "2",
        "3",
        "4",
        "5",
        "6",
        "7",
        "8",
        "9",
        "10",
        "11",
        "12",
        "13",
        "14",
        "15",
        "16",
        "17",
        "18",
        "19",
        "20",
        "21",
        "22",
        "23",
        "24",
        "25",
        "26",
        "27",
        "28",
        "29",
        "30",
        "31",
        "32",
        "33",
        "34",
        "35",
        "36",
        "37",
        "38",
        "39",
        "40"
      ],
      "healedAt": "2026-10-02T23:32:01.520646Z",
      "injected": true,
      "recoveredAt": "2026-10-02T23:32:01.653555Z",
      "restarted": true,
      "startedAt": "2026-10-02T23:31:46.139543Z",
      "stillRunning": true,
      "victimPid": 36192,
      "victimQuery": "select * from pgmq.read_with_poll($1,$2,coalesce($3,1),$4,$5,coalesce($6,'{}'::jsonb))",
      "victimWait": "Lock"
    }
  ],
  "outageSeconds": 10,
  "polling": "long-poll",
  "queueDepth": 0,
  "schema": "kenshou.queue-polling-observations/v1",
  "supervision": "ignore-failures",
  "warmupCompletedAt": "2026-10-02T23:31:46.139538Z"
}
